Post ID,Title,Url,Author,Score,Publish Date,Total No. of Comments,Permalink,Flair
ikx113,Facebook removes Russian accounts that targeted left-leaning Americans,https://qwerton.blogspot.com/2020/09/facebook-removes-russian-accounts-that.html,Daveliuz,1,2020-09-02 04:02:38,0,/r/worldnews/comments/ikx113/facebook_removes_russian_accounts_that_targeted/,NaN
ikx11m,"DHS, FBI rebut reports about hacked voter data on Russian forum",https://qwerton.blogspot.com/2020/09/dhs-fbi-rebut-reports-about-hacked.html,Daveliuz,1,2020-09-02 04:02:39,0,/r/worldnews/comments/ikx11m/dhs_fbi_rebut_reports_about_hacked_voter_data_on/,NaN
ikx11u,Polls close in Markey-Kennedy primary clash in Massachusetts,https://qwerton.blogspot.com/2020/09/polls-close-in-markey-kennedy-primary.html,Daveliuz,1,2020-09-02 04:02:40,0,/r/worldnews/comments/ikx11u/polls_close_in_markeykennedy_primary_clash_in/,NaN
ikx2id,Pimp my liver,https://youtu.be/OGOvu9lff2A,[deleted],1,2020-09-02 04:05:08,0,/r/worldnews/comments/ikx2id/pimp_my_liver/,No videos
ikx32o,"Scientists see downsides to top COVID-19 vaccines from Russia, China",https://www.reuters.com/article/us-health-coronavirus-vaccines-adenoviru/scientists-see-downsides-to-top-covid-19-vaccines-from-russia-china-idUSKBN25R19H,[deleted],1,2020-09-02 04:06:08,0,/r/worldnews/comments/ikx32o/scientists_see_downsides_to_top_covid19_vaccines/,COVID-19
ikx54w,Disapproval of Bolsonaro presidency jumps following global outcry over the government’s handling of record fires in the Amazon rainforest,https://www.reuters.com/article/us-brazil-politics-poll/disapproval-of-bolsonaro-presidency-jumps-after-amazon-crisis-poll-idUSKCN1VN19C,Defiant-Month,1,2020-09-02 04:09:55,0,/r/worldnews/comments/ikx54w/disapproval_of_bolsonaro_presidency_jumps/,NaN
ikx626,Natalie Portman opens up about climate crisis while showing support for new Athletes Unlimited,http://msplay.blogspot.com/2020/09/natalie-portman-opens-up-about-climate.html,msplay,1,2020-09-02 04:11:34,0,/r/worldnews/comments/ikx626/natalie_portman_opens_up_about_climate_crisis/,NaN
ikx62d,Olivia Wilde is stylish equestrian in black tank top and jodhpurs as she goes horseback riding in LA,http://msplay.blogspot.com/2020/09/olivia-wilde-is-stylish-equestrian-in.html,msplay,1,2020-09-02 04:11:35,0,/r/worldnews/comments/ikx62d/olivia_wilde_is_stylish_equestrian_in_black_tank/,NaN
ikx62o,Bindi Irwin recalls the emotional moment she found out she was pregnant,http://msplay.blogspot.com/2020/09/bindi-irwin-recalls-emotional-moment.html,msplay,1,2020-09-02 04:11:36,0,/r/worldnews/comments/ikx62o/bindi_irwin_recalls_the_emotional_moment_she/,NaN
ikx631,Hailey Bieber showcases her model figure in a yellow bikini as husband Justin snaps her,http://msplay.blogspot.com/2020/09/hailey-bieber-showcases-her-model.html,msplay,1,2020-09-02 04:11:37,0,/r/worldnews/comments/ikx631/hailey_bieber_showcases_her_model_figure_in_a/,NaN
ikx63i,Kourtney Kardashian shares flashback pictures with her children from their trip to Italy last summer,http://msplay.blogspot.com/2020/09/kourtney-kardashian-shares-flashback.html,msplay,1,2020-09-02 04:11:38,0,/r/worldnews/comments/ikx63i/kourtney_kardashian_shares_flashback_pictures/,NaN
ikx63s,Rylan Clark-Neal assures it's 'business as usual' on Strictly,http://msplay.blogspot.com/2020/09/rylan-clark-neal-assures-its-business.html,msplay,1,2020-09-02 04:11:39,0,/r/worldnews/comments/ikx63s/rylan_clarkneal_assures_its_business_as_usual_on/,NaN
ikx640,Miquita Oliver and AJ Odudu reveal they struggled with Black identity while growing up,http://msplay.blogspot.com/2020/09/miquita-oliver-and-aj-odudu-reveal-they.html,msplay,1,2020-09-02 04:11:40,0,/r/worldnews/comments/ikx640/miquita_oliver_and_aj_odudu_reveal_they_struggled/,NaN
ikx6hi,"China eyes military footing in Thailand, Myanmar and Pakistan: US",https://asia.nikkei.com/Politics/International-relations/China-eyes-military-footing-in-Thailand-Myanmar-and-Pakistan-US,zenonidenoni,1,2020-09-02 04:12:22,12,/r/worldnews/comments/ikx6hi/china_eyes_military_footing_in_thailand_myanmar/,NaN
ikxaxk,"Australia have announced ‘Donation Dollar’. A legal one dollar coin that asks people to donate if found. If every Australian donated a Donation Dollar just once a month, it would raise an additional $300 million annually for charities.",https://www.heraldsun.com.au/breaking-news/royal-australian-mint-unveils-heartfelt-initiative-behind-new-1-coin/news-story/024638d7abe884421eae0b1d7b1ef4bc?from=htc_rss,thepkmncenter,1,2020-09-02 04:20:08,57,/r/worldnews/comments/ikxaxk/australia_have_announced_donation_dollar_a_legal/,NaN
ikxba0,My garments will compete with the best in the world: Jemila Bulama,https://www.newslodge.com.ng/my-garments-will-compete-with-the-best-in-the-world-jemila-bulama/,newslodge,1,2020-09-02 04:20:43,0,/r/worldnews/comments/ikxba0/my_garments_will_compete_with_the_best_in_the/,NaN
ikxbak,Conspiracy to traffic orphan to Ghana by aborted uncle in Ebonyi,https://www.newslodge.com.ng/conspiracy-to-traffic-orphan-to-ghana-by-aborted-uncle-in-ebonyi/,newslodge,1,2020-09-02 04:20:45,0,/r/worldnews/comments/ikxbak/conspiracy_to_traffic_orphan_to_ghana_by_aborted/,NaN
ikxbq5,"DHS, FBI rebut reports about hacked voter data on Russian forum",https://coeasu.blogspot.com/2020/09/dhs-fbi-rebut-reports-about-hacked.html,angelamerkelx,1,2020-09-02 04:21:28,0,/r/worldnews/comments/ikxbq5/dhs_fbi_rebut_reports_about_hacked_voter_data_on/,NaN
ikxbqv,Polls close in Markey-Kennedy primary clash in Massachusetts,https://coeasu.blogspot.com/2020/09/polls-close-in-markey-kennedy-primary.html,angelamerkelx,1,2020-09-02 04:21:30,0,/r/worldnews/comments/ikxbqv/polls_close_in_markeykennedy_primary_clash_in/,NaN
ikxc8p,"Comrade Duch, Khmer Rouge prison commander, dies in Cambodia",https://www.theguardian.com/world/2020/sep/02/comrade-duch-khmer-rouge-dies-cambodia,pipsdontsqueak,1,2020-09-02 04:22:20,6,/r/worldnews/comments/ikxc8p/comrade_duch_khmer_rouge_prison_commander_dies_in/,NaN
ikxcif,Australia Launch World First Donation Dollar Designed To Be Given To Those In Need,http://www.mygc.com.au/australia-launch-world-first-donation-dollar-designed-to-be-given-to-those-in-need/,MarkAndrewSkates,1,2020-09-02 04:22:48,0,/r/worldnews/comments/ikxcif/australia_launch_world_first_donation_dollar/,NaN
ikxf89,Pompeo hopeful China's Confucius Institutes will be gone from U.S. by year-end,https://www.reuters.com/article/us-usa-china-pompeo/pompeo-hopeful-chinas-confucius-institutes-will-be-gone-from-us-by-year-end-idUSKBN25S6AV,ThanatoticMan,1,2020-09-02 04:27:38,17,/r/worldnews/comments/ikxf89/pompeo_hopeful_chinas_confucius_institutes_will/,NaN
ikxgsd,"Over 700,000 fake ‘Made in Taiwan' masks seized in three weeks | Taiwan News",https://www.taiwannews.com.tw/en/news/3999249,are0la,1,2020-09-02 04:30:25,9,/r/worldnews/comments/ikxgsd/over_700000_fake_made_in_taiwan_masks_seized_in/,NaN
ikxjh5,It’s Women’s Golf Day and these babes want you to talk birdie to them (50 Photos),https://hot-innews.blogspot.com/2020/09/its-womens-golf-day-and-these-babes.html,Hotinnews,1,2020-09-02 04:35:11,0,/r/worldnews/comments/ikxjh5/its_womens_golf_day_and_these_babes_want_you_to/,NaN
ikxk4x,Charlie Hebdo: Magazine republishes controversial Mohammed cartoons,https://www.bbc.com/news/world-europe-53985407,2ADF379FF404DEEF,1,2020-09-02 04:36:20,18,/r/worldnews/comments/ikxk4x/charlie_hebdo_magazine_republishes_controversial/,NaN
ikxkhs,"Tax avoiders blocked from honours list, secret UK government memo reveals - Tax avoiders are to be blocked from receiving knighthoods and other honours as authorities clamp down on rewarding “poor” financial behaviour.",https://www.independent.co.uk/news/uk/home-news/tax-avoidance-queens-honours-list-celebrities-uk-knighthoods-government-hmrc-a8517976.html,tester_tester2,1,2020-09-02 04:36:52,2,/r/worldnews/comments/ikxkhs/tax_avoiders_blocked_from_honours_list_secret_uk/,NaN
ikxl5l,"Claudia Pastor mamá de Fabricio Marín que fue noticia por necesitar dinero para su operación, una intervención por demás costosa que hizo que se pidiera ayuda en las redes sociales, la comunidas ayudó y eso dejó asombrada a Claudia que nos comentó además que mañana por fín lo",https://fmcosmos.com/2020/09/01/claudia-mama-de-fabricio-marin-el-corazon-de-los-sanjuaninos-es-una-bendicion/,cosmos935,1,2020-09-02 04:38:04,0,/r/worldnews/comments/ikxl5l/claudia_pastor_mamá_de_fabricio_marín_que_fue/,NaN
ikxlg6,"Trump, Biden Look to Kenosha for Their Vision of America https://ift.tt/eA8V8J",https://news4gh.blogspot.com/2020/09/trump-biden-look-to-kenosha-for-their.html,nkonsontv,1,2020-09-02 04:38:35,0,/r/worldnews/comments/ikxlg6/trump_biden_look_to_kenosha_for_their_vision_of/,US Internal News
ikxlgb,Owners of Iranian Fuel Seized by U.S. Assert Rights to Cargoes https://ift.tt/eA8V8J,https://news4gh.blogspot.com/2020/09/owners-of-iranian-fuel-seized-by-us.html,nkonsontv,1,2020-09-02 04:38:36,0,/r/worldnews/comments/ikxlgb/owners_of_iranian_fuel_seized_by_us_assert_rights/,NaN
ikxlgo,How Do We Fix the American Presidency? https://ift.tt/eA8V8J,https://news4gh.blogspot.com/2020/09/how-do-we-fix-american-presidency.html,nkonsontv,1,2020-09-02 04:38:37,0,/r/worldnews/comments/ikxlgo/how_do_we_fix_the_american_presidency/,NaN
ikxlgv,"'Ultra-Processed' Junk Food Linked to Advanced Ageing at Cellular Level, Study Finds",http://www.sciencealert.com/study-links-ultra-processed-junk-food-to-age-marker-in-chromosomes,auscrisos,1,2020-09-02 04:38:38,1209,/r/worldnews/comments/ikxlgv/ultraprocessed_junk_food_linked_to_advanced/,NaN
ikxlhk,"For Biden to Win, Listen to Minneapolis https://ift.tt/eA8V8J",https://news4gh.blogspot.com/2020/09/for-biden-to-win-listen-to-minneapolis.html,nkonsontv,1,2020-09-02 04:38:39,0,/r/worldnews/comments/ikxlhk/for_biden_to_win_listen_to_minneapolis/,US Internal News
ikxli1,U.S. Orders Eviction Moratorium for Most Through Year’s End https://ift.tt/eA8V8J,https://news4gh.blogspot.com/2020/09/us-orders-eviction-moratorium-for-most.html,nkonsontv,1,2020-09-02 04:38:40,0,/r/worldnews/comments/ikxli1/us_orders_eviction_moratorium_for_most_through/,NaN
ikxlii,"Trump Says Some Really Strange Things. Republicans Say No Comment, Again. https://ift.tt/eA8V8J",https://news4gh.blogspot.com/2020/09/trump-says-some-really-strange-things.html,nkonsontv,1,2020-09-02 04:38:41,0,/r/worldnews/comments/ikxlii/trump_says_some_really_strange_things_republicans/,NaN
ikxlir,Trump's Multiple Conspiracy Theories in Fox News Interview. Here Are Their Roots https://ift.tt/eA8V8J,https://news4gh.blogspot.com/2020/09/trumps-multiple-conspiracy-theories-in.html,nkonsontv,1,2020-09-02 04:38:42,0,/r/worldnews/comments/ikxlir/trumps_multiple_conspiracy_theories_in_fox_news/,NaN
ikxmtt,Mexico's 'Teflon' Presidency loses some sheen but survives,https://www.aljazeera.com/news/2020/09/mexico-teflon-presidency-loses-sheen-survives-200901202237990.html,sh0tgunben,1,2020-09-02 04:41:04,0,/r/worldnews/comments/ikxmtt/mexicos_teflon_presidency_loses_some_sheen_but/,NaN
ikxmx5,"Khmer Rouge’s chief jailer, guilty of war crimes, dies at 77",https://www.seattletimes.com/nation-world/khmer-rouges-chief-jailer-guilty-of-war-crimes-dies-at-77/?utm_source=RSS&amp;utm_medium=Referral&amp;utm_campaign=RSS_all,Jennysequoia,1,2020-09-02 04:41:14,0,/r/worldnews/comments/ikxmx5/khmer_rouges_chief_jailer_guilty_of_war_crimes/,NaN
ikxnsw,"The Khmer Rouge’s chief jailer, who admitted overseeing the torture and killings of as many as 16,000 Cambodians while running the regime’s most notorious prison, has died. Kaing Guek Eav, known as Duch.",https://apnews.com/6c76f8aa42cadf006fe6fcc84f2a1d0b,Balcacer,1,2020-09-02 04:42:43,0,/r/worldnews/comments/ikxnsw/the_khmer_rouges_chief_jailer_who_admitted/,NaN
ikxqjb,Notorious Khmer Rouge Prison Commander Comrade Duch Dead at 77,https://www.usnews.com/news/world/articles/2020-09-01/khmer-rouge-prison-commander-duch-dies-in-cambodia,wcypierre,1,2020-09-02 04:47:29,0,/r/worldnews/comments/ikxqjb/notorious_khmer_rouge_prison_commander_comrade/,NaN
ikxqvz,"US considers sanctions against Belarusians for election fraud, violence",https://www.scmp.com/news/world/united-states-canada/article/3099805/us-considers-sanctions-against-belarusians-election,wcypierre,1,2020-09-02 04:48:09,3,/r/worldnews/comments/ikxqvz/us_considers_sanctions_against_belarusians_for/,NaN
ikxuep,"Install CryptoTab browser and get real Bitcoins for using it. Your earnings will keep growing as long as you're watching YouTube, reading news and using your social network accounts daily.",https://cryptotabbrowser.com/15640005?s=rd,AmbitionExciting,1,2020-09-02 04:54:31,2,/r/worldnews/comments/ikxuep/install_cryptotab_browser_and_get_real_bitcoins/,NaN
ikxwcr,Coronavirus: The battle of living in lockdown with autism ... #health,https://news-rock.com/coronavirus-the-battle-of-living-in-lockdown-with-autism/?feed_id=3316&amp;_unique_id=5f4efc2e06c1c,NewsRock,1,2020-09-02 04:58:06,0,/r/worldnews/comments/ikxwcr/coronavirus_the_battle_of_living_in_lockdown_with/,COVID-19
ikxwdz,A coronavirus survivor's myth: 'I touched dying' ... #health,https://news-rock.com/a-coronavirus-survivors-myth-i-touched-dying/?feed_id=3349&amp;_unique_id=5f4efc31c7764,NewsRock,1,2020-09-02 04:58:10,0,/r/worldnews/comments/ikxwdz/a_coronavirus_survivors_myth_i_touched_dying/,COVID-19
ikxwf9,GPs to trial Covid medication to dwell severe signs ... #health,https://news-rock.com/gps-to-trial-covid-medication-to-dwell-severe-signs/?feed_id=3360&amp;_unique_id=5f4efc358d390,NewsRock,1,2020-09-02 04:58:13,0,/r/worldnews/comments/ikxwf9/gps_to_trial_covid_medication_to_dwell_severe/,COVID-19
